{
  "assurance_id": "model-assurance-6b5-v1",
  "assurance_identity_sha256": "f504defefdd87bcbb01c670b68469ba4c0e016be7f40ca89452baf69b73f39f5",
  "capabilities": [
    {
      "acceptance_verdict": "ACCEPT_WITH_P2",
      "allowed_claims": [
        "Retrospective mathematical alternatives were exactly derived and fully scenario-verified for human review."
      ],
      "capability_id": "decision_alternatives",
      "display_name": "Constrained Decision Alternatives Engine v1",
      "evidence": {
        "evaluation_population": "115 donor units and 460 policy-budget alternative sets.",
        "key_metrics": {
          "full_verification_failures": 0,
          "full_verification_success_rate": 1.0,
          "primary_direct_complete_rate_budget_0_25": 0.3625,
          "primary_direct_complete_rate_budget_1_00": 0.575,
          "receiver_worsening_count": 0
        },
        "known_findings": {
          "P0": [],
          "P1": [],
          "P2": [
            "runtime approximately 6.7 hours",
            "peak RSS slightly above nominal 2 GiB",
            "bounded shortlist drops"
          ]
        },
        "target": "registrations",
        "temporal_protocol": "Retrospective EVALUATION at the three validation origins and final-test origin, horizons 1-14."
      },
      "evidence_status": "ACCEPTED",
      "forbidden_claims": [
        "AI recommender",
        "patient router",
        "capacity optimizer",
        "physical feasibility",
        "causal benefit"
      ],
      "freshness": {
        "reason": "Static accepted evidence has no approved production refresh SLA or runtime publication state.",
        "state": "UNKNOWN"
      },
      "governance": {
        "autonomous_action": false,
        "capacity_checked": false,
        "causal_effect_claimed": false,
        "human_review_required": true,
        "physical_feasibility_status": "NOT_VALIDATED",
        "promotion_status": "NO_PROMOTION",
        "serving_claim": false
      },
      "identities": {
        "artifact_sha256": {
          "reason": "Recorded in the referenced accepted repository evidence.",
          "status": "AVAILABLE",
          "value": "4c7924e1a849f9d9396f8ea0443d918ab595aa64f1e72d5ffae0a76a5cbe1a4a"
        },
        "calibration_identity": {
          "reason": "calibration_identity does not apply to capability decision_alternatives.",
          "status": "NOT_APPLICABLE",
          "value": null
        },
        "code_identity_sha256": {
          "reason": "Recorded in the referenced accepted repository evidence.",
          "status": "AVAILABLE",
          "value": "6650c937eca290db606c1e0adf667e3022d82d09e0b2fa8794f0dbb89c7894b8"
        },
        "config_identity_sha256": {
          "reason": "Recorded in the referenced accepted repository evidence.",
          "status": "AVAILABLE",
          "value": "ad63b08972a6e3b2f5320bc74d68ebc216e20f0b05beb61588f69ada04c19523"
        },
        "dataset_identity_sha256": {
          "reason": "Recorded in the referenced accepted repository evidence.",
          "status": "AVAILABLE",
          "value": "49d7e69546b0dee53c89fa23964edfa40b823aa9829a972414f28dad74bd7dc0"
        },
        "decision_alternative_identity": {
          "reason": "Recorded in the referenced accepted repository evidence.",
          "status": "AVAILABLE",
          "value": "constrained-decision-alternatives-v1"
        },
        "estimand_id": {
          "reason": "estimand_id does not apply to capability decision_alternatives.",
          "status": "NOT_APPLICABLE",
          "value": null
        },
        "hierarchy_identity": {
          "reason": "hierarchy_identity does not apply to capability decision_alternatives.",
          "status": "NOT_APPLICABLE",
          "value": null
        },
        "model_identity": {
          "reason": "model_identity does not apply to capability decision_alternatives.",
          "status": "NOT_APPLICABLE",
          "value": null
        },
        "pressure_provider_identity": {
          "reason": "Recorded in the referenced accepted repository evidence.",
          "status": "AVAILABLE",
          "value": "historical_flow_proxy_v1"
        },
        "prioritization_identity": {
          "reason": "Recorded in the referenced accepted repository evidence.",
          "status": "AVAILABLE",
          "value": "signals-inbox-v1"
        },
        "run_id": {
          "reason": "Recorded in the referenced accepted repository evidence.",
          "status": "AVAILABLE",
          "value": "decision-alternatives-6b4-real-v3"
        },
        "scenario_identity": {
          "reason": "Recorded in the referenced accepted repository evidence.",
          "status": "AVAILABLE",
          "value": "forecast-stress-test-v1"
        },
        "scientific_identity_sha256": {
          "reason": "Recorded in the referenced accepted repository evidence.",
          "status": "AVAILABLE",
          "value": "fb7410fa230d4c252c58cbbe98e4ccfbe45102800d5422ba45f8ce79d788a7a8"
        }
      },
      "limitations": [
        "Policy budgets are not capacity",
        "physical feasibility is unknown",
        "outputs are retrospective."
      ],
      "product_consumption_status": "EVALUATION_ONLY",
      "run_manifest": "artifacts/runs/decision-alternatives-6b4-real-v3/run.json",
      "source_lineage": [
        "docs/project-evidence-index.md#14-constrained-decision-alternatives-engine-v1",
        "docs/decision-alternatives-6b4.md",
        "artifacts/runs/decision-alternatives-6b4-real-v3/run.json"
      ],
      "support": {
        "range_semantics": [
          "COMPLETE",
          "RANGE_LIMITED"
        ],
        "support_semantics": [
          "DIRECT_SUPPORTED",
          "FALLBACK_LIMITED",
          "UNSUPPORTED"
        ]
      }
    },
    {
      "acceptance_verdict": "ACCEPT",
      "allowed_claims": [
        "Central forecasts are exactly coherent under bottom-up hospital aggregation."
      ],
      "capability_id": "flow_hierarchical_coherence",
      "display_name": "Hierarchical central forecast coherence",
      "evidence": {
        "key_metrics": {
          "child_rows_changed": 0,
          "exact_central_coherence": true
        },
        "primary_fallback_semantics": "Hospital child rows unchanged; region and national central forecasts summed bottom-up; sparse hospital series use reviewed regional-share fallback.",
        "target": [
          "registrations",
          "cohort_hospitalizations"
        ],
        "temporal_protocol": "Rolling-origin validation selected hierarchy; final test did not select it."
      },
      "evidence_status": "ACCEPTED",
      "forbidden_claims": [
        "probabilistic reconciliation",
        "occupancy",
        "capacity"
      ],
      "freshness": {
        "reason": "Static accepted evidence has no approved production refresh SLA or runtime publication state.",
        "state": "UNKNOWN"
      },
      "governance": {
        "autonomous_action": false,
        "capacity_checked": false,
        "causal_effect_claimed": false,
        "human_review_required": true,
        "physical_feasibility_status": "NOT_APPLICABLE",
        "promotion_status": "HUMAN_REVIEW_ONLY",
        "serving_claim": false
      },
      "identities": {
        "artifact_sha256": {
          "reason": "Recorded in the referenced accepted repository evidence.",
          "status": "AVAILABLE",
          "value": "d3ef9c4072f18eea9e8cd6c49dd4e696ed6adde61eb5029b5f094b34c31b5d11"
        },
        "calibration_identity": {
          "reason": "Recorded in the referenced accepted repository evidence.",
          "status": "AVAILABLE",
          "value": "temporal-count-interval-calibration-v1-802a155f4e8c"
        },
        "code_identity_sha256": {
          "reason": "Recorded in the referenced accepted repository evidence.",
          "status": "AVAILABLE",
          "value": "3d95329d075e65759883d67600c2e7d716ebf3b90260eed64b85b1ccea9a6dff"
        },
        "config_identity_sha256": {
          "reason": "Recorded in the referenced accepted repository evidence.",
          "status": "AVAILABLE",
          "value": "55641e07bdfb1255717e1a211d66f745021e8ddfbd12cc8655bf91f8e14d0886"
        },
        "dataset_identity_sha256": {
          "reason": "Recorded in the referenced accepted repository evidence.",
          "status": "AVAILABLE",
          "value": "49d7e69546b0dee53c89fa23964edfa40b823aa9829a972414f28dad74bd7dc0"
        },
        "decision_alternative_identity": {
          "reason": "decision_alternative_identity does not apply to capability flow_hierarchical_coherence.",
          "status": "NOT_APPLICABLE",
          "value": null
        },
        "estimand_id": {
          "reason": "estimand_id does not apply to capability flow_hierarchical_coherence.",
          "status": "NOT_APPLICABLE",
          "value": null
        },
        "hierarchy_identity": {
          "reason": "Recorded in the referenced accepted repository evidence.",
          "status": "AVAILABLE",
          "value": "bottom_up_hospital"
        },
        "model_identity": {
          "reason": "model_identity does not apply to capability flow_hierarchical_coherence.",
          "status": "NOT_APPLICABLE",
          "value": null
        },
        "pressure_provider_identity": {
          "reason": "pressure_provider_identity does not apply to capability flow_hierarchical_coherence.",
          "status": "NOT_APPLICABLE",
          "value": null
        },
        "prioritization_identity": {
          "reason": "prioritization_identity does not apply to capability flow_hierarchical_coherence.",
          "status": "NOT_APPLICABLE",
          "value": null
        },
        "run_id": {
          "reason": "Recorded in the referenced accepted repository evidence.",
          "status": "AVAILABLE",
          "value": "flow-hierarchy-6b2b3-real-v1"
        },